{
  "sf3d_repository": "https://github.com/Stability-AI/stable-fast-3d",
  "license_reviewed": false,
  "asset_hosting_authorized": false,
  "sf3d_repo": null,
  "python_executable": null,
  "pretrained_model": "stabilityai/stable-fast-3d",
  "manifest_path": "tools/ruff_3d/manifest.json",
  "creatures_path": "app/src/main/assets/creatures.json",
  "export_root": ".source-export/Privat und Geteilt/Ruff",
  "output_dir": ".artifacts/3d/models",
  "log_dir": ".artifacts/3d/logs",
  "asset_base_url": null,
  "timeout_seconds": 900,
  "max_attempts": 2,
  "retry_delay_seconds": 5,
  "parallelism": 1,
  "texture_resolution": 1024,
  "remesh_option": "none",
  "target_vertex_count": -1,
  "gltf_validator_executable": "gltf_validator",
  "require_external_glb_validation": true,
  "notion_api_version": "2022-06-28",
  "notion_max_retries": 3
}
